{
  "baseline_release": "PGF 1.0.0",
  "source_path": "PGF/08_Privacy_Risk_Appetite_Statement_EN.md",
  "source_sha256": "168a0f18908e60771e391969b22f7a017eb1378109b4661c5faec318d4659bbe",
  "source_part_section": "Part B, Section 4",
  "matrix": {
    "Minor": {
      "Low": "Low",
      "Medium": "Low",
      "High": "Low",
      "Near-certain": "Low"
    },
    "Moderate": {
      "Low": "Low",
      "Medium": "Low",
      "High": "Medium",
      "Near-certain": "Medium"
    },
    "Significant": {
      "Low": "Medium",
      "Medium": "Medium",
      "High": "High",
      "Near-certain": "High"
    },
    "Catastrophic": {
      "Low": "High",
      "Medium": "High",
      "High": "Critical",
      "Near-certain": "Critical"
    }
  }
}
